High-Speed Internet,Internet,Wifi,High-Speed Internet Perfect for Ensuring All Business Runs Smoothly,$65.00,-1
Private Internet,Internet,Wifi,Exclusive Internet Package Dedicated Exclusively For You,$95.00,-1
All-Access Television,Internet,Television,All Standard Cable Channels and Movies Available On Demand,$50.00,-1
Netflix,Internet,Television,Netflix Shows and Movies Available On Demand,$95.00,-1
Hulu,Internet,Television,Hulu Shows and Movies Available On Demand,$90.00,-1
ESPN,Internet,Television,ESPN Sports Available On Demand,$75.00,-1
Disney Plus,Internet,Television,Disney Shows and Movies Available On Demand,$95.00,-1